Finding,Insight,Action
Cellular vs Telephone,Cellular converts at 14.7% vs 5.2% telephone,Shift budget to cellular outreach
Prior successful leads,Prior success = 65.1% conversion — 7x baseline,Build re-engagement list before new campaigns
Best job segments,"Students (31.4%), Retirees (25.2%) outperform average",Target students and retirees with tailored offers
Best months,Mar/Sep/Oct/Dec convert at 44-51% vs May at 6.4%,"Run campaigns in high-rate months, reduce May volume"
Call count drop-off,Conversion drops from 13% (1 call) to 3.1% (10+ calls),Cap contacts at 3 calls per lead
